{
  "id": "print",
  "name": "Print",
  "description": "Greyscale-safe: weights, dashes and fills instead of hue. For printing and accessibility.",
  "extends": null,
  "color": {
    "background": "#FFFFFF",
    "surface": "#F2F2F2",
    "surfaceAlt": "#E3E3E3",
    "ink": "#000000",
    "inkMuted": "#4A4A4A",
    "line": "#8C8C8C",
    "lineStrong": "#1A1A1A",
    "accent": "#1A1A1A",
    "accentInk": "#FFFFFF",
    "highlight": "#5E5E5E",
    "categorical": ["#1A1A1A", "#6B6B6B", "#A6A6A6", "#3D3D3D", "#888888", "#C4C4C4"],
    "status": { "new": "#3D3D3D", "changed": "#6B6B6B", "retired": "#A6A6A6", "atRisk": "#000000" }
  },
  "font": {
    "family": "Inter",
    "files": { "regular": "fonts/Inter-Regular.ttf", "semibold": "fonts/Inter-SemiBold.ttf" },
    "size": { "title": 28, "subtitle": 16, "group": 15, "label": 14, "body": 12, "caption": 11 },
    "weight": { "title": 600, "label": 600, "body": 400 },
    "titleCase": "sentence",
    "lineHeight": 1.3
  },
  "shape": { "radius": 4, "stroke": 1.25, "strokeStrong": 2.5, "shadow": "none", "chevronDepth": 18 },
  "space": { "unit": 8, "gap": 16, "padding": 16, "margin": 48 },
  "connector": { "style": "orthogonal", "arrow": "triangle", "cornerRadius": 0 },
  "style": { "renderer": "clean", "showIcons": false, "accentFill": "solid", "headerRule": true, "bandFill": "surface" }
}
