{
  "id": "databricks",
  "name": "Databricks",
  "description": "Databricks brand look: white canvas with oat panels, navy ink, grey-blue connectors, DM Sans type, lava reserved for the Databricks account, Unity Catalog and emphasis, amber and blue numbered flows. Default for databricks-architecture diagrams.",
  "extends": null,
  "color": {
    "background": "#FFFFFF",
    "surface": "#F9F7F4",
    "surfaceAlt": "#EEEDE9",
    "ink": "#1B3139",
    "inkMuted": "#5A6F77",
    "line": "#A3AFB4",
    "lineStrong": "#618794",
    "accent": "#FF3621",
    "accentInk": "#0B2026",
    "highlight": "#2272B4",
    "categorical": ["#FF3621", "#2272B4", "#00875C", "#1B5162", "#98102A", "#8B6A00"],
    "status": {
      "new": "#00875C",
      "changed": "#B26B00",
      "retired": "#A3AFB4",
      "atRisk": "#98102A"
    },
    "notation": {
      "step": "#FFAB00",
      "stepInk": "#0B2026",
      "flow2": "#4299E0",
      "network": "#2272B4",
      "zone": "#B26B00",
      "account": "#FF5F46",
      "cloud": "#7587FF",
      "plane": "#1B5162",
      "platform": "#1B5162",
      "governance": "#FF3621",
      "stageHead": "#D9D9D9",
      "bronze": "#BF8970",
      "silver": "#90A5B1",
      "gold": "#D4AF37"
    }
  },
  "font": {
    "family": "DM Sans",
    "files": {
      "regular": "fonts/DMSans-Regular.ttf",
      "semibold": "fonts/DMSans-SemiBold.ttf",
      "bold": "fonts/DMSans-Bold.ttf"
    },
    "size": {
      "title": 24,
      "subtitle": 14,
      "group": 13,
      "label": 12,
      "body": 11,
      "caption": 11
    },
    "weight": {
      "title": 700,
      "label": 600,
      "body": 400
    },
    "titleCase": "sentence",
    "lineHeight": 1.3
  },
  "shape": {
    "radius": 8,
    "stroke": 1,
    "strokeStrong": 1.5,
    "shadow": "none",
    "chevronDepth": 16
  },
  "space": {
    "unit": 8,
    "gap": 24,
    "padding": 16,
    "margin": 40
  },
  "connector": {
    "style": "orthogonal",
    "arrow": "triangle",
    "cornerRadius": 4
  },
  "style": {
    "renderer": "clean",
    "showIcons": false,
    "accentFill": "tint",
    "headerRule": false,
    "bandFill": "surface"
  }
}
