{
  "id": "boardroom",
  "name": "Boardroom",
  "description": "Restrained, consulting-style: navy and slate with one teal highlight. Default for board and ExCo packs.",
  "extends": null,
  "color": {
    "background": "#FFFFFF",
    "surface": "#F5F7FA",
    "surfaceAlt": "#E9EDF2",
    "ink": "#1B2733",
    "inkMuted": "#5B6875",
    "line": "#9AA5B1",
    "lineStrong": "#3E4C59",
    "accent": "#0B3D91",
    "accentInk": "#FFFFFF",
    "highlight": "#00A3A3",
    "categorical": ["#0B3D91", "#00A3A3", "#7A5CFA", "#E07B39", "#4C9F38", "#C2185B"],
    "status": { "new": "#4C9F38", "changed": "#E0A800", "retired": "#9AA5B1", "atRisk": "#C62828" }
  },
  "font": {
    "family": "Inter",
    "files": { "regular": "fonts/Inter-Regular.ttf", "semibold": "fonts/Inter-SemiBold.ttf" },
    "size": { "title": 28, "subtitle": 16, "group": 15, "label": 14, "body": 12, "caption": 11 },
    "weight": { "title": 600, "label": 600, "body": 400 },
    "titleCase": "sentence",
    "lineHeight": 1.3
  },
  "shape": { "radius": 6, "stroke": 1.25, "strokeStrong": 2, "shadow": "none", "chevronDepth": 18 },
  "space": { "unit": 8, "gap": 16, "padding": 16, "margin": 48 },
  "connector": { "style": "orthogonal", "arrow": "triangle", "cornerRadius": 4 },
  "style": { "renderer": "clean", "showIcons": false, "accentFill": "tint", "headerRule": true, "bandFill": "surface" }
}
